CompanyName,Category,Country,Description,Website,LogoURL
dunnhumby,partner,,"dunnhumby is the global leader in Customer Data Science, empowering businesses to thrive in the modern data-driven economy. Our mission: to enable businesses to grow and reimagine themselves by becoming advocates and champions for their Customers.

With deep heritage and expertise in retail — one of the world’s most competitive markets — dunnhumby enables businesses across industries to be Customer First.

The dunnhumby Customer Data Science Platform combines technology, software and consulting to help businesses increase revenue and profits by delivering exceptional Customer experiences – in-store, offline and online. We employ over 2,500 experts across Europe, Asia, Africa, and the Americas, working with iconic brands like Tesco, Walmart, Meijer, Procter & Gamble, Coop, and L’Oréal.",https://www.dunnhumby.com/,
DuoKey SA,startup,,"DuoKey is a leading provider of enterprise cloud and data security, specialising in data protection and AI. The company focuses on multi-cloud encryption key management, confidential AI, and Post-Quantum Cryptography (PQC), enabling organisations to lever",https://duokey.com,
DWS Engraving,startup,,"DWS has redefined product personalization in both retail and e-commerce with its elegant, compact laser engraving machines that integrate seamlessly into luxury merchandising environments.",https://dws-engraving.com/en/,
Dydu,partner,,"Depuis 2009, Dydu propose une plateforme no code intuitive à destination des professionnels pour concevoir en toute autonomie des agents conversationnels intelligents : chatbot, voicebot, callbot.
Nos solutions s’appuient sur la compréhension du langage naturel, l’intelligence artificielle et l’IA Générative pour alléger le quotidien des équipes support tout en améliorant la satisfaction des utilisateurs.
Déployés dans le cadre de plus de 160 projets SaaS ou on-premise, les bots Dydu adressent des problématiques de service client et de support aux collaborateurs (RH, helpdesk IT, juridique…) dans des secteurs aussi variés que l’énergie, l’industrie automobile, la finance, les assurances, les transports, le tourisme, les télécoms ou le secteur public.",https://www.dydu.ai/,
Dylogy,startup,,"Dylogy est une startup française qui aide assureurs, réassureurs et courtiers à exploiter leurs documents et mieux gérer leurs risques grâce à l’IA générative. Soutenue par la French Tech, elle a levé 2 M€ et atteint près de 1 M€ de revenus en 2024.",http://www.dylogy.com,
Dynamo S.p.A,partner,,"Dynamo unlocks the power of a new European cloud and data ecosystem by fostering a dynamic community, providing a cutting-edge federated platform, complemented by the most innovative commercial marketplace for cloud services—a true one-stop shop. 


This ecosystem unites European cloud service providers, enabling end-users to gain full control of their data and solutions, avoid vendor lock-in, and innovate with best-in-class solutions. 


Dynamo is also playing a pivotal role in shaping the future of Europe’s cloud market through key initiatives, such as co-launching the SECA Standard (Sovereign European Cloud API) and supporting the EuroStack movement.


If you're an enterprise using cloud technology, a provider, or a startup active in the cloud market, feel free to stop by for a chat or even a demo—whatever suits you!
",https://www.dynamo.cloud/,
DynaNIC Semiconductor,startup,,"DynaNIC Semiconductor is a deep tech university spin-off specializing in flexible, high-speed backbone connectivity solutions for the telecom and data center sectors. We are currently seeking seed funding to accelerate our go-to-market strategy.
",https://www.dyna-nic.com,
Dynatos Design,startup,,"Dynatos Design builds inclusive, AI-powered tools to reveal unseen talent. Human-first. Accessible. Trusted by major companies. DE&I in action.",https://www.dynatos-design.com,
E Ethylene,startup,,"Transforming captured CO2 into renewable base chemicals for a sustainable chemical industry.
Deeptech spin-off of CNRS / University of Montpellier.",https://www.e-ethylene.com,
E Reo,startup,,"E-Reo digitize indigenous languages to build memory and spread endangered languages.
We deploy mobile apps that showcase the content chosen by our customers. Available on Google and Apple store in less than 48 hours. Content update available instantly.",https://www.e-reo-platform.com/,
E-business school,startup,,"Acteur engagé dans l'éducation supérieure.
💻 à distance via notre campus virtuel en direct,
📍 ou en présentiel dans 4 campus innovants
Objectif : Offrir aux jeunes des zones rurales les mêmes chances de réussite que ceux des grandes villes",https://www.e-campus-solutions.com/,
E-miRgency,startup,,"e-miRgency is transforming cancer diagnostic and patient follow-up by using miRNA as biomarkers with our patented breakthrough technology.
",https://www.e-mirgency.com,
E-PEAS,startup,,"e-peas revolutionizes IoT with energy harvesting solutions, eliminating disposable batteries by using light, RF, heat, and motion. Our PMICs achieve up to 95% efficiency and integrate seamlessly with various energy sources.",https://e-peas.com,
E-PIEZO,startup,,E-PIEZO develops and commercialises ultrasound-generation devices for use in mechanical testing at high frequencies. Our devices allow industrial users to perform mechanical tests 100 times faster than with conventional machines.,https://www.e-piezo.com,
E-Plato,startup,,"Socrate, the enterprise knowledge hub that makes corporate information accessible and actionable, without sacrificing security. It optimizes search, analysis, and security without migration, ensuring data sovereignty and seamless integration. ",https://e-plato.com,
e-satisfaction,startup,,"e-satisfaction is the leading Voice of Customer solution in Greece that captures CX data across touchpoints, provides actionable & AI-powered reporting and customer engagement mechanisms, to help improve customer satisfaction & operational excellence.",https://www.e-satisfaction.com/,
E-TARANIS,startup,,"E-Taranis is based in the Basque Country. It is reinventing energy with breakthrough and innovative solutions. The company designs and manufactures a lightweight, ultra-silent sail wind turbine. Its goal is to make domestic wind energy accessible to every",https://www.etaranis.fr,
E-TCHEK,startup,,"Notre solution digitale simplifie votre flux d'informations et de communications, améliore votre réactivité ainsi que la traçabilité de l'information.

Agile et polyvalente, l'offre E-TCHEK est votre outil de constatations participatives",https://www.e-tchek.com/,
E2R SOLUTIONS,startup,,E2R Solutions is a Guinean startup specializing in the reconditioning and recycling of electronic devices. It also trains young people to become cell phone and computer repairers.,https://e2r-solutions.com,
E4RTH,startup,,"E4RTH enables maximum transparency for all types of projects: climate, social, and even political donations, via blockchain-based documentation. Our tech ensures traceable CO2 compensation and answers the key question: Where did my money go?",https://www.fore4rth.com,
each One,startup,France,each One helps refugees and newly arrived individuals return to sustainable employment and enables companies to recruit the talent that makes them stronger in every way.,https://www.eachone.co,
Earthian AI,startup,,Earthian AI is an AI-native platform for granular and asset-level environmental risk assessment — loved by the world's largest financial firms.,https://earthianai.com,
EARTHWAKE ENTREPRISE,startup,,"Earthwake Entreprise is developing a decentralised, containerised pyrolysis solution for recovering non-recycled plastic waste.",https://www.earthwake.fr/,
EasyBiz,startup,,EasyBiz is the digital-first way to launch and run your business in Luxembourg. We handle incorporation and accounting for SMEs with a smart platform and local expert support — so you can focus on what you do best.,https://easybiz.lu/,
Easyrain,startup,,"Easyrain is the pioneering company having been delivered the first ever anti-aquaplaning solutions. Our technology transforms vehicle safety and saves lives by enhancing traditional vehicles, and autonomous driving across hazardous low-grip conditions",https://easyrain.it/,
Eazy Chain,startup,,"Eazy Chain is a shipping company that offers sea-short service in West Africa, connecting major hub ports to smaller ports with a wind-powered vessel connected to a digital platform that helps users to book shipments, and track cargo in real time.",https://www.eazy-chain.com,
EBS Group,startup,,"EBS Group, your digital transformation expert. We support you in every step of the way with a range of complementary and interconnected solutions from a single partner.",https://www.ebsgroup.fr,
Ecal,startup,,"ECAL is the worlds leading calendar marketing platform, delivering smart, dynamic and personalised events content directly into the personal digital calendar of users, to keep them up-to-date, connected and engaged.",https://ecal.com/,
EcoComply,startup,,"EcoComply is the AI-powered compliance platform that helps manufacturers automate environmental and product regulations - so they can launch faster, stay audit-ready, and scale globally with one-click implementation.",https://www.ecocomply.ai,
ECODAIR,startup,,"Fort de ses 20 ans d’expertise, Ecodair reconditionne plus de 60 000 équipements informatiques chaque année et crée des emplois solidaires pour et avec des personnes en situation de handicap et d’insertion.",https://www.ecodair.com/,
Ecolab - Commissariat Général au Développement Durable,partner,,"Ecolab, the laboratory of innovation in service of ecological transition is located within the General Commissariat for Sustainable Development (CGDD). The CGDD, an interministerial actor and a cross-cutting directorate of the ministry responsible for the environment – enlightens and fuels, through the production of data and analyses, the action of the ministry. It offers a comprehensive vision of environmental issues. It runs the greentech innovation initiative, which aims to stimulate the French greentech ecosystem, in particular by supporting French start-ups and SMEs providing innovative solutions capable of accelerating the ecological transition.",https://greentechinnovation.fr/,
Ecolab High-tech ,startup,,Ecolab High-tech is the leading African startup in the field of XR and Metaverse. We develop immersif and interactive virtual labs for schools and educational institutions.,https://tech.ecolab-hightech.net,
ECOMESURE,startup,,"Ecomesure provides air quality monitoring stations and cloud platforms for real-time environmental monitoring. The end-to-end solution helps industries, cities, and companies worldwide track pollution and drive sustainability with actionable data and AI.",https://ecomesure.com/en,
ECTOR,startup,,"Ector is the leading operator of valet parking services at airports and train stations since 2013 offering travelers a digital, personalized, and cost-effective solution to enhance their travel experience.",https://www.ectorparking.com,
EDCORE,startup,,"Dynamic AI agents are revolutionizing manufacturing operations. Discover how our solutions can help you achieve over 20% energy savings, reduce downtime by more than 10%, and increase productivity by 12%. ",https://www.edcore.co.kr/,
EDF,partner,,"The world is now racing against time in the face of climate change, making innovation more essential than ever. Confronting this challenge and staying true to its “raison d’être”, the EDF Group has committed to expanding opportunities to achieve net zero emissions sooner. Since 2017, the Group has invested approximately €540 million in startups focused on advancing the energy transition.",https://www.edf.fr/en,
edtake,startup,,"edtake is the essential AI copilot for creating any type of training material in just minutes. It helps learning creators to design, produce, and adapt learning materials from existing sources, using AI.",https://www.edtake.com,
EduBolt,startup,,"EduBolt is a future-focused learning platform blending AI, hands-on prep, and global opportunities. From med to tech, we’re not just tutoring, we’re transforming. Want in? The future’s already learning with us. ⚡️ 

#SucceedTomorrow",www.edubolt.co,
EDUCATIONAL TECHNOLOGY AND SCIENCE,startup,,"RESEARCH, DEVELOPMENT AND TRADE OF ASSISTIVE TECHNOLOGY FOR PEOPLE WITH VISUAL IMPAIRMENT.
OUR MAIN PRODUCTS DEVELOPED ARE IN THE EDUCATION AREA, WHERE OUR MAIN TARGET AUDIENCE IS FOUND, SUCH AS TEACHERS AND STUDENTS.",www.tece.com.br,
Edunao,startup,,"Depuis plus de 10 ans, Edunao accompagne les acteurs de l’éducation et de la formation dans leur transition numérique, en créant des écosystèmes d’apprentissage accessibles, efficaces et centrés sur l’humain grâce aux technologies digitales.",www.edunao.com,
EF Polymer K.K.,startup,,"Producing world's only 100% organic and biodegradable superabsorbent polymer (EFP). With EFP, farmers can save up to 40% water and 20% on fertilizer uses while increasing yields by 10-15%. EFP can also be used for daily and sanitary  products.",https://efpolymer.com,
EFFIGY,startup,France,"Effigy-3D, Paris, is a pioneering digital creation company. We produce interactive AI AVATARS applications, combining visual appeal and practical functionalities; a new generation of digital assistants, designed to improve customer service 24/7.",https://www.effigy-3d.com,
EFIMOVE,startup,,"ARKYCE by Efimove: the SaaS AI platform that structures field knowledge, secures maintenance, and speeds up onboarding for industrial SMEs and mid-sized companies.",https://efimove.ai,
EFLOW,startup,,"EFLOW is powering the next generation of high-performance, high-efficiency AFPM motors. Their AFPM motors offer 2x the output torque at 1/3 the weight.
",https://eflow.kr,
EFREI,partner,,"Grande Ecole du Numérique depuis 1936 labellisée CTI, et leader indépendant reconnu d’intérêt public par l’Etat (EESPIG), l’Efrei couvre tous les secteurs du numérique, de l’ingénierie au management. Depuis janvier 2022, l’Efrei a intégré Paris Panthéon-Assas Université en tant qu’établissement composante.

Installée à Paris ainsi qu’à Bordeaux, l’Efrei accueille 5 700 étudiants, technophiles et engagés dans la transformation numérique – mais également communicants, ouverts à l’international et formés au travail en équipe et management.",https://www.efrei.fr/,
EGMA,startup,,"The EGMA Platform offers power, gas, and environmental products (e.g., CEE, GOO), as well as indicative prices and energy market access within a secure environment.",https://gem.engie.com,
eGreenBadge SAAS,startup,,"The first AI-powered system connecting consumers, businesses & recyclers with real-time data, rewards, and Scope 3 impact insights turning waste into value and enabling national-scale circularity. Fully trackable. Fully measurable",https://egreenbadge.com,
EINBLIQ.IO,startup,,"EINBLIQ.IO optimizes streaming by using real-time data to enhance quality, reduce costs, and save energy. It automates issue resolution and CDN steering while offering ISPs insights beyond speed tests for smarter decisions and superior user experience.",https://einbliq.io,
Ejari,startup,,"Ejari is a financial services platform on a mission to make renting a home more affordable and flexible. Ejari decreases the financial burden of moving into a new home and offers greater flexibility with how and when to pay rent.
",https://ejari.sa/,
EKA Surgery,startup,,"EKA Surgery exploits artificial intelligence and surgical video technologies to generate actionable information aimed at improving surgical quality, streamlining procedures and limiting the risks taken by surgeons.
",https://eka.surgery,
Ekimetrics,partner,,"In the next 10 years, all Business Models will be deeply reshaped by AI and Sustainability.  

Ekimetrics’ mission is to empower organizations with AI solutions in that context, and help companies be future-proof. We specialize in optimizing revenue, profit and mission-critical operations through a blend of AI solutions and service. 

Ekimetrics is a global leader in data science and AI-powered solutions, with offices across 3 continents, and a team of 500+ data, MMM (Marketing Mix Modeling) and AI experts. 

We're committed to delivering business impact at scale, through sustainable and ethical AI practices. ",https://www.ekimetrics.com/fr,
EKOO,startup,,"EKOO brings brands to life with audio 🎧 capsules embedded in their digital journeys. The voice 🎙️ of experts and customers enhances experience, builds trust and drives action. Trusted by TAG Heuer, Sephora, Carrefour and BNP Paribas.
",https://ekoo.co/,
"Elcyo Co., Ltd.",startup,,"Leveraging Fresnel liquid crystal lens technology, Elcyo has made it possible to create glasses that maintain focus at any distance, addressing a wide range of vision challenges across healthcare, entertainment, and beyond.",https://en.elcyo.com,
Electra,startup,France,"Electra is the French leader in ultra-fast charging for electric vehicles. Operating in 9 countries, deploying reliable infrastructure and a seamless customer experience with a goal of 15,000 charging points by 2030.",https://www.go-electra.com/fr/,
ELECTRA,startup,,"Electra is the French leader in ultra-fast charging for electric vehicles.
Operating in 9 countries, with over 1,300 operational charging points and a goal of 15,000 by 2030, Electra is at the heart of the European electric transition.",https://www.go-electra.com/fr/,
Electric Oasis,startup,,"electric OASIS is an electric charging infrastructure solution for companies. Simple, quick to install and scalable without civil engineering. Not sure what to do ? Try it for 3 months with no obligation !",https://electric-oasis.eu,
Electrogenos,startup,,Electrogenos' technology cuts the cost of green hydrogen by 30%. Our alkaline electrolyser stacks can be manufactured anywhere locally at just $85/kW — 5× cheaper than EU and 1.5× cheaper than Chinese competitors — while delivering 20% higher efficiency. ,https://electrogenos.co.uk,
Elementag,startup,,"Inorganic DNA for Products and Raw Materials. Elementag is the nanomarker that blends into any material or product, to make it traceable, authentic and to fight against its counterfeiting.",https://www.elementag.it,
ElevenLabs,startup,UK,"ElevenLabs is an AI Audio research and deployment company. 

Our research team develops AI Audio models that generate realistic, versatile and contextually-aware speech and sound effects",https://elevenlabs.io,
ELEYA,startup,France,"With AI Agents that reproduce the behavior of target populations, we remove the constraints of study lead times and access to rare populations, paving the way for large-scale qualitative studies.",https://www.linkedin.com/company/eleya-eu,
eLimu World,startup,,"eLimu provides fun and accessible education for curious children across Africa through a digital app with interactive stories, games, animations and simulations.",https://www.e-limu.org,
Elips,startup,France,"Elips is the AI sales agent for pipeline follow-ups. 

It cleans CRM data, creates individual strategies, and executes timely and personalised nurturing to boost conversion.

So no opportunity goes cold or is ever forgotten.",https://elips.ai,
ElleQuant,startup,,"Hybrid intelligence for better informed investment decisions: Half-human, half-AI. Ellequant helps GPs and Private Market scale deal flow and optimize deal insights. In a competitive landscape, funds focus on better sourcing and LPs seek unique advantages",https://invest.ellequant.com/,
Ellii,startup,France,"Ellii accompagne seniors et proches aidants de manière personnalisée et préventive via son application web et ses activités adaptées animées en ligne, collectives et interactives, afin de rester en forme tout en s'amusant.",https://www.ellii.net,
Elora,startup,,"Respond to all calls instantly with Elora by creating custom Gen AI assistants in under an hour to boost your customer satisfaction with helpful responses. 
",https://www.elora.lu,
elpyoo,startup,,"Elpyoo is the first digital platform dedicated to supporting employee caregivers. We offer tailored content, human support, and tools to help companies identify, support, and better manage caregiving within their workforce.",https://elpyoo.com/,
Elpyoo,startup,,"Elpyoo is the first digital platform dedicated to supporting employee caregivers. We offer tailored content, human support, and tools to help companies identify, support, and better manage caregiving within their workforce.",https://elpyoo.com/,
Elsee,startup,,"First reimbursement platform making natural health & wellbeing accessible and affordable for women by reimbursing out-of-pocket wellness expenses, including supplements, alternative medicine, sports, mental health and apps.",https://www.elsee.care,
eMaisha Pay,startup,,"eMaisha Pay is digitizing payments, and supply chain management, to unlock trade financing for small and medium agri-traders in emerging markets. ",https://www.emaishapay.com,
Emallu,startup,,"Specialized in eco-friendly, unbreakable screen protectors made in France from recycled polymers. We serve both B2C and B2B markets with durable, cut-to-fit films that won't crack, offering sustainable, high-performance protection for all devices.",https://www.emallu.com,
eMerge Americas,startup,,"eMerge Americas is the premier global technology conference in Miami, attracting 20,000+ attendees, 1,000+ investors, and 4,300+ organizations from over 60 countries, fueling innovation and market growth in the Florida and Latin America tech ecosystems.",https://emergeamericas.com/,
Emiotech,startup,,"XpertVisio empowers field teams with smart AR headsets, remote expert access, and video-based procedures—boosting efficiency, safety, and know-how sharing in industrial environments.
Meet us at VivaTech to test it yoursefl !",https://www.xpertvisio.tech,
Emirats Arabes Unis - Ministry of Economy,partner,,"To develop a flexible economy of the future that ensures a prosperous business environment and encourages investment and talent attraction through the development of proactive policies, to raise the standard of living and prosperity of the society.",https://www.moec.gov.ae/en/who-we-are,
EmitIQ,startup,,"EmitIQ is an AI platform for sustainability, combining carbon accounting, ESG, LCA, and carbon credit generation in one system. Built for global compliance, EmitIQ helps organizations and project developers turn data into action and impact at scale.",https://www.emitiq.com/,
emma ,startup,,"emma is a cloud management platform that simplifies multi-cloud operations. It’s no/low-code, AI-powered, and built for both IT and business users to reduce costs, optimize resources, and boost compliance, security, and ease of use across clouds.",https://www.emma.ms,
Emobot,startup,France,"EMOBOT has developed a clinically validated remote monitoring platform for mood disorders. EMOBOT passively and continuously tracks patients' mood using facial expression, speech, sleep, and activity patterns, with no input required. ",https://www.emobothealth.com,
Emovo Care,startup,,"Emovo develops a neural robotic hand exoskeleton to support people with motor impairments (for example stroke), at home and in clinics.",https://emovocare.com/,
EMS-LENS,startup,,"EMS-Lens accelerates energy management projects by providing operational insights through simulation. Validate and optimize complex business cases, enhance control strategies, and understand system behavior for innovative energy solutions.",https://www.laborelec.com/company-profile/,
Emvista,startup,,"Emvista, based in Montpellier, develops AI solutions that extract and structure 100% of the information from text. Its technology, Prevyo Event, turns reports and transcripts into actionable events for monitoring, alerting, and market intelligence.",https://emvista.com/,
EmyeHR,startup,,"EmyeHR is the first AI-native, human-first HR management platform designed to work for you, not make you work. Delegate time-consuming tasks to your AI companions and focus on what truly matters: people !
EmyeHR in 1 min 👉 https://youtu.be/a8Wy33GFQ98",https://www.emye.fr,
En-Boucle,startup,,"En-boucle: Circular fashion for kids, reimagined.
Second-hand clothing, eco-workshops, B2B ski gear rental with smart tracking, and a concept store for sustainable brands.
Bold. Practical. Planet-first.",https://www.en-boucle.com,
ENACT AI Cluster,partner,,"The ENACT AI Cluster is a program supported by Université de Lorraine, the University of Strasbourg
and their partners (CNRS, Inria, Inserm, Nancy University Hospital, Strasbourg University Hospitals) and
funded by the French government (via ANR under France 2030), the Grand Est Region, Métropole du
Grand Nancy, Eurométropole de Strasbourg and companies, which aims to make Grand Est a European
leader in AI training, research and innovation. The research part intends, among other objectives, to
triple the number of doctoral students in AI in all disciplines by 2030, with a stronger focus on 3 themes
of excellence (natural language processing and multimodal LLMs, AI for engineering and scientific
discovery, digital health), and to increase interdisciplinarity, internationalization and relations between
the Lorraine and Strasbourg university sites.

ENACT is supported by France 2030. ",https://cluster-ia-enact.ai/,
