CompanyName,Category,Country,Description,Website,LogoURL
Krill Design Srl,startup,,"Krill Design transforms food by-products into REKRILL®, a patented, 100% biobased, compostable, and recyclable biopolymer. We combine design, science, and circular thinking to replace traditional plastics with a sustainable, high-performance material.

",https://en.krilldesign.net,
Krisspy AI,startup,,"By 2030, every digital product will be AI-built before it’s human-built.
Krisspy is leading that shift.

We’re building the AI-native product layer:
From prompt to prototype to production UI — Krisspy helps PMs, designers, and teams turn ideas into real p",https://krisspy.ai/,
"KRISTINCOMPANY Co., Ltd.",startup,,"Kristin Company turns bold ideas into real shoes.
With ShoeCatch for AI design and Sinple for smart manufacturing, we turn sketches into products—fast.
From imagination to reality, we make every step seamless.",https://www.kristincompany.com/,
Kruncher,startup,,"Kruncher is the AI analyst for private markets. It's like having a dedicated team of analysts for every startup in your pipeline: constantly monitoring, calculating, and generating relevant insights on your behalf. ",https://kruncher.ai,
Kuli,startup,,"Kuli is an AI platform that analyzes thousands of creators’ posts in seconds. Kuli helps brands take faster and better decisions at every stage of their influencer collaborations, from creator vetting to performance optimization.",www.kuli.one,
Kumulus,startup,France,"Kumulus - The water utility company of the future. We create drinking water from air in a sustainable and economical way. Through technological innovation, we produce and operate machines that turn air into fresh drinking water.",https://www.kumuluswater.com,
Kunagi,startup,,"Tired of WhatsApp?
Kunagi is a toolbox designed for developers, social housing providers, and local authorities. It empowers residents and project stakeholders to co-create the city of tomorrow.
From a neighborhood social network app to user-centered des",https://www.kunagi.fr/,
KUZZLE,startup,,"Kuzzle is a French publisher of turnkey Data, IoT, and Hypervision solutions. Modular and scalable, they enable you to go from PoC to industrialisation, with expert support for the most demanding logistics use cases.",https://kuzzle.io,
KViTKA by Global Ukraine,startup,,"Global Diaspora FinTech Banking Platform
White-label BaaS & Crowdfunding social FinTech, empowering diasporas through financial Inclusion and cross-border services including multi-currency accounts, cross-border payments, and international remittances. 

",www.kvitka.fr,
Kwan-tek,startup,,"KWAN-TEK is a French startup pioneering diamond-based quantum sensors using NV centers. It develops high-precision tools for magnetic, thermal, and non-destructive testing, targeting aerospace, defense, and education markets.",http://www.kwan-tek.com,
Kwarto,startup,France,"kwarto is a 3D+AI SaaS platform using digital twins to speed up telecom deployment, optimize operations and reduce carbon print. We empower mobile operators, TowerCos and datacenters with real-time monitoring, data insights and efficient site management.",https://kwarto.io,
kwarto.,startup,France,"kwarto is a 3D+AI SaaS platform using digital twins to speed up telecom deployment, optimize operations and reduce carbon print. We empower Mobile operators, TowerCos and Datacenters with real-time monitoring, data insights and efficient site management.",https://kwarto.io,
Kweichow Moutai Paris Trading ,partner,,"Kweichow Moutai Paris Trading a été fondée en 2014 dans le 8ème arrondissement à Paris, filiale à 100 % du groupe. Elle fait partie de la stratégie d’internationalisation du groupe, fondée sur la complémentarité de nos activités et répartitions géographiques. Les principales activités sont de distribution et de conseil en vente, marketing et gestion pour baijiu Kweichow Moutai sur le marché européen.",https://www.moutaichina.fr/,
Kwit,startup,,Revolutionizing addiction treatment: Kwit's digital therapeutics harness behavioral science and gamification to free people from dependencies. WHO-validated apps with 4.5M users worldwide. Transforming health challenges into engaging recovery journeys.,https://kwit.app,
Kwore,startup,France,"Create. Assess. Plan.
Kwore lets teams craft on-brand, hyper-personalized content, leverage AI for performance forecasting, align posts with business objectives, and collaborate seamlessly—making social media mastery accessible to all.",https://kwore.com/,
L'Escalator,partner,,"L'Escalator is a startup incubator with a strong mission: to give talented entrepreneurs a real chance, regardless of their background, resources, or network. Open to all with no age or degree requirements, it supports project founders over a period of 6 to 12 months, focusing on motivation, teamwork, and each entrepreneur's potential.

L'Escalator offers comprehensive and completely free support: personalized coaching, mentoring, training, and networking opportunities. Thanks to the backing of top-tier partners such as L’Oréal, TotalEnergies, Meta, JCDecaux Holding, and BNP Paribas, startups benefit from a rich ecosystem full of expertise and opportunities.

Committed to inclusion and sustainability, L'Escalator encourages the emergence of new businesses across a wide variety of sectors.",https://lescalator.com/,
L'incubateur Science & Vie,partner,,"Découvrez les startups soutenues par Science&Vie ! 
L'innovation est résolument dans l'ADN Science&Vie. 
Depuis des années, nous révélons les jeunes talents avec le concours Innovez de Science&Vie Junior et depuis un an, nous propulsons les start-up prometteuses grâce à l'Incubateur Science&Vie.
Ces projets innovants, à impact, touchent le grand public à travers nos médias.
Ne manquez pas l'occasion de rencontrer nos inventrices et inventeurs et d'échanger avec eux sur notre stand le samedi 14 juin !",https://www.science-et-vie.com/incubateur-science-et-vie,
L'OREAL GROUPE,partner,,$2c,https://www.loreal.com/en/,
L&SMART,startup,,"L&Smart is reinventing Building Management Systems (BMS) with a distinctly simple, efficient, and accessible approach. ",https://www.lsmart.co/,
L2 Concept,startup,,"HALF by L2concept: an ultra-light 120 kg chassis carrying 400 kg+, fully adaptable, collaborative R&D (Factory Unit, Motion Engineering, BPI, ADEME). Open source, delivered flat (2D). Shared, circular, and inclusive mobility—let’s co-create the future of ",https://www.l2concept.com/,
L4BOX,startup,,"L4BOX develops TokTokBox, a large interactive device that fosters emotional social learning and builds digital educational environments. Combining real-world play with AI-powered content, it supports schools, homes, and resorts, and is expanding globally.",http://www.toktokbox.co.kr,
La Cantine des Talents,startup,,"La cantine des Talents recrute des profils sur des métiers en tension pour moins cher que les méthodes traditionnelles. 

Grâce à notre expertise en data, tracking et ciblage avancé, nous appliquons les méthodes éprouvées du e-commerce au recrutement.",https://lacantinedestalents.fr,
La Carte des Talents ,startup,,La Carte des Talents est un outil simple et rapide pour vous aider à faire un pas de plus dans votre carrière.,www.lacartedestalents.com,
LA FABE,startup,France,"La Fabe develops the new generation of business Parks. It aims to replace the obsolete and old-fashioned inventory of business Parks with state-of-the art, smart, durable and digital-enabled buildings. ",https://www.la-fabe.fr,
La Fresque du Numerique,startup,France,"La Fresque du Numerique (The Digital Collage) is an interactive, team-based workshop to explore the environmental impacts of our digital practices and provide concrete solutions to reduce them. Together, let's build a more responsible digital future !",https://www.fresquedunumerique.org,
LA POSTE GROUPE,partner,,"As a founding partner of the event, and in line with his strategic plan, la Poste Group demonstrates at VivaTechnology its commitment toward environmental transition and its expertise in developing great innovations for all customers. Along  with its 227,000 postal employees and its wide physical and digital infrastructures, with an inhouse porfoliot of 150 innovations constantly reviewed, La Poste is collaborating to the digital transformation, building trustable digital services and promoting digital inclusion while enhancing the common assets of the society as a whole.",https://www.lapostegroupe.com/fr,
La Rebelle Connect,startup,,"La Rebelle Connect cultivates the careers of performing artists in film, television, and live performances. We provide tailored training programs and career support to help our talent succeed. ",https://www.larebelleconnect.com,
LA SENTINELLE,startup,,"la sentinelle is a service design and user experience (UX) agency. We support our clients' innovation strategy by designing simple, effective, and useful products in sectors such as health, transport, energy, and research. ",https://www.la-sentinelle.fr,
LA TOUCHE MUSICALE,startup,,"La Touche Musicale builds AI-powered apps to help musicians transcribe and learn music effortlessly. From audio to sheet music or interactive practice tools, our mission is to simplify musical creation and education through smart technology with our AI's.",https://latouchemusicale.com/,
la Vitre,startup,,"The presence experience, made simply. To be there, especially when you're not.  A new habit, certainly, but above all, a gesture we're all familiar with. You knock, and you're together. As simple as that.",https://lavitre.fr,
Laborelec SA,startup,,,https://www.laborelec.com/renewables-services-home/,
LabSae,startup,France,LabSae offers an AI-powered computational platform to discover and analyze protein interaction networks. It allows biopharma companies to optimize preclinical studies and significantly reduce the costs and time required for experimental validation.,https://www.labsae.com,
Lacess Limited ,startup,,"Founded in 2020, KIBO leverages over 50 years of shoemaking heritage, integrating advanced recycled materials and ergonomic design, with tech-enabled innovation to manufacture engineer eco-conscious, high-performance footwear. ",www.kibo.eco,
Lae sante,startup,France,"Laé transforms the healthcare journey with a unique solution combining AI and proactive coordination. It connects prescribers, patients, and healthcare professionals through an intuitive platform, enhancing collaboration and improving care outcomes.",https://www.lae-sante.com,
LAIKA By AITEM,startup,,"AITEM is the tech company behind LAIKA, an AI tool developed specifically for veterinarians, to support every phase of the clinical process from anamnesis to therapy, analyzing data and suggesting differential diagnoses through chat and document uploading",https://laika.aitemsolutions.com/home,
LAIPIC AI,partner,,"LAIPIC is a Chinese AIGC company that was established in Qianhai, Shenzhen on July 30, 2015. Since its establishment, LAIPIC has relied on its own 18 million animation data assets, independently developed the SkinSoul animation model, successfully created AI animation and AI digital human generation tools, built a digital human MCN and AI education platform, and incubated the AI hardware brand InnAIO. Combining a good-looking Skin with an interesting Soul, it is committed to realizing the next generation of interaction methods with AI. To date, the LAIPIC platform has generated tens of millions of creative works, served over 30 million users, and covered more than 180 countries and regions around the world. It has always been committed to providing the world with faster and better AI products.",https://www.laipic.ai/,
Lampi AI,startup,France,"Lampi AI enables financial firms to deploy a team of confidential AI agents that can generate analyses, memos, and reports, and dynamically complete tables by analyzing and reasoning across hundreds of documents or leveraging the entire web.",https://www.lampi.ai/,
Langcode,startup,,"We help B2B clients adopt gen-AI through our enterprise-grade AI Agent platform. Langcode CXP provides comprehensive features to build, manage and utilize AI agents. CXP has been proven by 30+ enterprise clients such as Mercedes Benz, Chanel and KT.",https://langcode.io,
LatenceTech,startup,,"LatenceTech is revolutionizing network management with an innovative software solution that combines artificial intelligence and real-time processing. We measure, predict, and diagnose network quality to anticipate problems & ensure optimal performance",https://www.latencetech.com/,
Latitude,startup,,"Latitude is a pioneering French aerospace company with a passion for pushing the boundaries of space technologies to improve our future. Founded in 2019, Latitude specializes in the development of a space launch vehicle, named Zephyr.",latitude.eu,
LaundryWell,startup,,"LaundryWell replaces rigid, costly laundry systems with a tech-enabled, on-demand solution that improves service quality, ensures compliance, cuts turnaround time, and helps industries like healthcare and senior care focus on what they do best.",https://www.laundrywell.com/,
LAWXER,startup,,"LAWXER automates your contract analysis to save you time, reduce risk and improve productivity.
---
LAWXER automatise l’analyse de vos contrats pour vous faire gagner du temps, réduire les risques et améliorer votre productivité.
",www.lawxer.ai,
Lazuli Inc.,startup,Japan,"We provide a Product Data Platform that uses generative AI to collect, generate, and structure product data across channels. It supports customer analysis using tags, enables seamless customer experiences, and facilitates data integration across systems.",https://lazuli.ninja/en/top/,
LE CATALYST,startup,,"Bridging science and marketing to build authentic cosmetic brands with transparent, evidence-based claims.	",https://www.lecatalyst.fr/,
Le French Gut,startup,,"Discover Lhe French Gut, a groundbreaking research project engaging citizens to better understand the gut microbiota and its impact on health. Join us to explore how your microbes can shape the future of personalized nutrition and medicine!",www.lefrenchgut.fr,
Le Koinpost,startup,,Le Koinpost is a platform that connects residents to local composting points and rewards them with organic produce in exchange for logging their food waste deposits on the app.,https://www.lekoinpost.com,
Le Lab RH,partner,,"Le Lab RH is a non-profit association under the French law of 1901, which brings together players in the field of HR innovation, with the mission of transforming HR practices over the long term.  
Its mission is to promote HR innovation through a dynamic community of companies, startups, HR professionals and experts with a shared interest in modernizing HR practices.

In a few figures, it's :
- more than 1,000 HR professionals on board
- 250 HR startups
- a large LinkedIn community with 128,000 subscribers",https://lab-rh.com/,
Le réseau des Carnot,partner,,"The Carnot network comprises public research structures, certified by the French Ministry in charge of Research, committed to developing research partnerships that promote innovation in businesses of all sizes – from SMEs to large corporations – and among socio-economic stakeholders.

Carnot’s 35 000 research professionals account for 20% of all French public sector researchers and handle 55% of all R&D contracts outsourced by private companies to French public research bodies.

The network offers a broad range of expertise for devising solutions to the R&I needs of companies in most sectors. In order to harness their complementarity and unlock synergies for their stakeholders, the different Institutes are organised within an operational network headed up by AiCarnot.
The Carnot institutes seek out continuous enhanced professionalism in their relationship with partners, from initial cont",https://www.lereseaudescarnot.fr/en,
Leadbay,startup,France,"AI that predict your next clients. Leadbay is a domain-specific AI model for B2B sales trained on exhaustive market data, internal company knowledge (CRM, ERP, CSV), and reps' instincts together—with the capability to predict who will be your next custome",https://www.leadbay.ai/,
Learnetic,startup,,"AI-powered EdTech solutions for publishers, schools & teachers: content creation, LMS, authoring, and 40,000+ ready-made interactive lessons.",https://www.learnetic.com/,
LEARNING ROBOTS,startup,,"Learning Robots provides educational solutions to teach Artificial Intelligence in a friendly, concrete and progressive way. The AlphAI software allows to discover neural networks, machine learning and algorithms by taming a small robot.",https://www.learningrobots.ai,
Lebonchar,startup,,Lebonchar connects businesses with talented and qualified freelancers and entrepreneurs from Priority Urban Zones (QPV) and Rural Revitalization Zones (ZRR). We support diversity and inclusion in the workforce. ,https://www.lebonchar.fr,
Lecturer,startup,,The AI academic-staffing platform.,https://www.lecturer.app,
LEET DESIGN,partner,,,https://leet-design.com,
LEETS,startup,,"Leets helps you find sports partners in your area to run, train or play team sports with. Thanks to intelligent matching and a fun environment, Leets makes sport fun, social and accessible.",https://www.leets.app,
Leexi,startup,,"Leexi est un IA Notetaker

- ISO27001, GDPR, EU AI act
- Souveraineté des données en Europe
- En hyper croissance 100% à Bruxelles

Déjà 12.000 enreprises de 1 à 2000 users nous font confiance dans toute l'Europe.",https://www.leexi.ai/en/,
Leg&airy SA,startup,,"Leg&airy is transforming orthotics and prosthetics with an AI-powered platform that enables clinics to design, fit, and monitor smart, personalized devices in days instead of months.",http://promo.legandairy.com,
LEGAPASS,startup,,"Legapass automates AML/CFT compliance for notaries and regulated professions through innovative tech solutions. Less risk, more efficiency, zero stress !",https://legapass.com,
LeHibou,partner,,"Avec une croissance de 60 % de son chiffre d’affaires en 2023 (82 M€) et un objectif atteint de 120 M€ en 2024, LeHibou poursuit son développement en France et à l’international ! 

Pour couronner cette croissance, la société est fière d’intégrer la FRENCH TECH Next 40 cette année. 

Leader des plateformes de services entre freelances Tech/Innovation et grandes entreprises, LeHibou dépoussière le consulting informatique avec les codes du freelancing. 

Grâce à l’intelligence artificielle et au Big Data, elle accélère la transformation digitale des entreprises du CAC40/SBF120. Son modèle hybride combine digital et accompagnement personnalisé.

Déjà plus de 120 000 consultants inscrits et des bureaux ouverts à Bordeaux, Toulouse, Nantes, Lyon, Marseille, ainsi qu’en Belgique et aux Pays-Bas. ",https://www.lehibou.com,
LEHOSAH,startup,,"LEHOSAH is an AI-powered jewelry tech company combining 40 years of manufacturing expertise with generative AI. Our core platform, ChromaKey, enables real-time 2D/3D design and streamlines end-to-end production for brands across fashion, beauty, and enter",https://www.lehosah.com,
LEION,startup,China,"Founded in 2014, LLVision is the global leader of AR+AI platforms. LLVISION will launch new LEION HEY2 in 2025, which only weights 40+g and can translate 100+ languages in real time, bringing communication back to its natural state.",https://www.llvision.com,
Leminnov,startup,,"LEMINNOV is a deeptech startup specializing in Cloud Native, Edge Computing and AI. We design innovative and composable infrastructure solutions to empower smart digital business applications with agility, security and high performance.",https://www.leminnov.com,
LEMO ,partner,,"Reliable Connections when Failure is not an Option
 
With a history of over 75 years of excellence and innovation, the LEMO Group is proud to be a global leader in the field of custom high-performance interconnection solutions. From the deepest depths of the oceans to the farthest reaches of outer space, our interconnection solutions will always meet the highest expectations.

No matter how harsh the environment or critical the connections, we have the solution at hand. We produce metal and plastic connectors, high-performance wiring and cables, cable assemblies and adapt our products to your needs. From raw materials to finished products, we develop and produce everything necessary in-house to connect customer applications and seamlessly transfer fibre optic signals, power, fluid or high-speed data.

",https://www.lemo.com/our-world/company/about-us,
Lemon Motion,startup,,"Designer and manufacturer of electric drive systems for bikes/motorcycles, made in France.	",https://lemonmotion.com,
Lengo Pay,startup,,"Lengo Pay, a digital payment solution from Guinea, West Africa, drives payment digitization across the continent. It empowers businesses, merchants, freelancers, associations, and public administrations to send and receive payments simply.",https://www.lengopay.com,
LEOBLUE,startup,,"LEOBLUE is developping a satellite-to-smartphone solution, affordable and sovereign solution ensures critical communication even in the most remote or disrupted areas using  Bluetooth without terrestrial needs.  ",https://leoblue.eu,
LEON,startup,,"Leon creates immersive, artistic podcasts that bring places and stories to life. From tourism to education and elder care, we use sound to reconnect people with culture, heritage, and each other — making the invisible, audible.",www.invest.leon-guide.app,
Leonardo.Ai,startup,,Leonardo.Ai is a powerful AI content production suite helping millions bring their ideas to life with production-quality images and videos. Our mission is to empower creators with tools that boost creativity and streamline visual content creation. ,https://leonardo.ai/,
LEPTY,startup,,"We turn aluminum into a clean, recyclable fuel to power generators and electric motors with zero emission.",https://lepty.fr,
Les Assistants virtuels ,startup,,"France Titres - ANTS is providing new services based on generative AI for users support. 
Since October 2024, a chatbot provides general information on driving licenses and vehicle registration procedures.

",https://ants.gouv.fr/,
Les CCE-conseillers du commerce ext,startup,,"4900 femmes et hommes dirigeants et chefs d’entreprise, experts de l’international au service du développement de la France depuis plus de 120 ans. Présents dans toutes les régions de France et dans plus de 152 pays. Nommés par le premier ministre.",https://www.cnccef.org/,
Les Guiboles,startup,,"Les Guiboles is an innovative digital solution for managing walking school buses. It simplifies their organization by centralizing the presence registration of child travelers and accompaniers, and automating the solicitation of reservees.",https://www.lesguiboles.com,
LES MARTINES,startup,France,"Les Martines is a social network of mutual support, created by and for women  to connect, share freely and uplift each other in a safe space.",https://www.lesmartines.app,
LES PETITS LABOS,startup,,"Les Petits Labos is an interdisciplinary research and creation lab. Its main objective is to explore new, eco-responsible modes of production that serve artistic creation.
",https://lespetitslabos.com/,
Les Ripeurs,startup,,"Les Ripeurs is a French logistics platform for construction waste and materials. We offer efficient collection, sorting, and recycling services, helping companies reduce environmental impact and comply with regulations.",https://www.lesripeurs.com/,
Lesbonsplanoff,startup,,"Our platform references the most original experiences to live: unusual accommodation, surprising activities, immersive restaurants. For each reservation, an extra is offered. For individuals or companies: book the unforgettable.",https://lesbonsplansoff.com/,
Leson,startup,,"

Leson is a true haute couture sound workshop whose vocation is to design unique and innovative audio solutions. We offer a large portfolio of patented technologies and high-end products aimed at both content producers and broadcasters.",https://www.musicunit.fr/leson,
Letsignit,partner,,"Letsignit is the leading SaaS platform for managing and deploying professional email signatures at scale. Effortlessly create, standardize, and update signatures with our intuitive drag-and-drop designer and ready-to-use templates. Centralized management ensures brand consistency and compliance across every email, while advanced campaign management lets you integrate internal or external banners into signatures, turning daily emails into powerful marketing channels. With Letsignit’s vCard feature, employees can share up-to-date contact details via clickable links or QR codes directly in their signature. Letsignit integrates with Office 365 and Google Workspace, offers automated directory sync, analytics, mobile compatibility, and multi-signature support. Trusted by over 2,000,000 users worldwide. Elevate your brand with every email sent.

Schedule a meeting 👉 https://bit.ly/3F6Ray5",https://letsignit.com/,
LetsLaw,startup,,"LETSLAW is a Digital Business Law Firm founded in 2012, that provides 360º legal and financial advice, both nationally and internationally, aimed at small and large companies that are immersed in the entrepreneurial ecosystem",https://letslaw.es/en/,
Letxbe.ai,startup,France,"Letxbe is the AI-powered case management platform built to simplify and accelerate complex workflows. From incoming emails to attachments and documents, Letxbe intelligently captures, classifies, and routes information so nothing falls through the cracks.",https://www.letxbe.ai/,
