CompanyName,Category,Country,Description,Website,LogoURL
Preta Porter Cosmetics,startup,,"Preta Porter Cosmetics is a brand that celebrates beauty in its essence, with high-quality products that value diversity and inclusion. Our brand is known for its luxurious and sophisticated products that meet the needs and preferences of black women.
",https://www.lojapretaporter.com.br/,
PREVIA MEDICAL,startup,,"Predict and prevent life-threatening emergencies by anticipating serious clinical risks, using real-time analysis of patient data to improve the safety, responsiveness and quality of care in healthcare establishments.",https://www.previa-medical.com,
Previeew,startup,,"The plateform that brings together media and music professionals!
Professionals add their outings, journalists access the list and rate them
At a time when more than 120,000 titles are released every day, we have created a platform that will save journal",https://www.previeew.com,
Prewave,startup,,"We are Prewave. Supply chain superintelligence. We engineer the only future-ready sustainability, risk and compliance platform; building strong supply chains and protecting your reputation, performance and profitability.",https://www.prewave.com/,
Prezevent,startup,France,"Prezevent is a SaaS provider offering an event management solution that digitizes complex and time-consuming processes often overlooked by CRMs and event agencies. Our mission is to make events a driver of growth and engagement for all organizations.
",https://www.prezevent.com,
Prima Mente,startup,UK,"Prima Mente discovers novel biology to understand the human brain, to protect ourselves against disease and enhance ourselves in health. Our team of scientists, AI researchers, and clinicians generate our own biological datasets, build frontier AI models,",https://www.primamente.com/,
PRIMINOV,startup,,"Real-time AI-powered speech-to-text translator, ""OHAIO Live Speaker"" is an innovative tool offering simultaneous translation in 100+ languages with fully customizable tone, vocabulary, and context to match your brand and audience.", https://ohaio.ai,
Primo Conciergerie,startup,,"Primo Conciergerie, leader français de la conciergerie haut de gamme, allie innovation digitale et service humain. Avec 340 agences prévues d’ici 2028, nous offrons un modèle rentable et durable dans l’immobilier, le voyage et le service premium.",https://primoconciergerie.fr/,
PRINSUS,startup,,"The core activities of PRINSUS are the provision of services to the agri-food sector to develop innovative products, to upgrade and evolve into innovative technologies and business models.",https://prinsus.eu,
Prio Optics,startup,,Prio Optics is revolutionizing optical filters with cutting-edge printing technology. We provide affordable and customizable optical coatings and filters with minimized environmental impact during production.,https://www.prio-optics.com,
Prisme AI,startup,,"Your enterprise Agentic AI Platform to create, connect, deploy, and monitor your AI agents at scale.
From simple chat to complex multi-agent systems, Prisme.ai provides the tools you need to turn your company's Gen.AI goals into ROI.",https://www.prisme.ai,
Prisme.ai,startup,,"Your enterprise Agentic AI Platform to create, connect, deploy, and monitor your AI agents at scale.
From simple chat to complex multi-agent systems, Prisme.ai provides the tools you need to turn your company's Gen.AI goals into ROI.",https://www.prisme.ai,
Privadsy,startup,,"Privadsy is the go-to platform for content creators who want to maximize their earnings effortlessly. Our innovative tools empower creators to discover performance marketing opportunities, manage SmartLinks efficiently, and display engaging visual ads.",https://privadsy.link/vivatech,
PrivaSapien Technologies ,startup,,"PrivaSapien is an innovation-driven company solving privacy and responsible AI challenges. We empower enterprises with ethical, secure, and compliant AI setting a new global standard that protects privacy and digital rights over data monetization.",https://www.privasapien.com/,
PROBABL,startup,France,"Probabl powers scikit-learn, the world’s leading open-source machine learning library. We build sustainable AI tools for real-world data science: open, trustworthy, and production-ready.",probabl.ai,
Procero Inc.,startup,Canada,"Procero offers a software-based solution that optimizes the performance and energy consumption of AI workloads
on compute-bound and memory-bound devices, without requiring code or architectural changes.",https://www.procero.ai,
PRODEA DEPOLLUTING,startup,,"Prodea Depolluting is specialized in cutting-edge technologies for industrial emissions remediation and other applications. Our aim is to tackle some of the most pressing challenges today : air pollution, making sustainability both effective &accessible.
",https://prodea-depolluting.com,
"Prodrone Co., Ltd.",startup,,"Prodrone, a world-leading developer and manufacturer of unmanned aerial vehicles (UAVs), draws upon its 130 patented technologies to create compact yet powerful and stable UAVs suitable for emergency missions. ",https://www.prodrone.com,
PROFIBRES,startup,,"INDUSTRIAL MANUFACTURER OF WHEAT STRAW INSULATION , ASSOCIATED WITH AN AGRICULTURAL COOPERATIVE. FIRST ACTOR IN EUROPE, WE WANT TO DEVELOPPED LOCAL BUSINNESS UNIT ALL OVER FRANCE AND EUROPE. ",https://www.profibres.fr,
Projectal,startup,,"Projectal is an AI cloud platform that revolutionizes how Media and Entertainment businesses handle bidding, budgeting, planning, scheduling, tracking and reporting for their productions, departments, locations and staff.",https://projectal.com,
PROJEQTOR,startup,,"ProjeQtOr is a Free Project Management Software that has grown on a model of collaborative innovation.
It integrates innovative and powefull features and covers the entire scope of Projects and Portfolio Management.",https://www.projeqtor.org,
Prometheus-X,startup,,"Prometheus-X is a European non-profit initiative developing open-source building blocks for open, decentralized infrastructure enabling ethical, secure, and interoperable data sharing in education and skills.",https://www.prometheus-x.org,
PROMUS,startup,,"Promus digitizes the food supply chain for more sustainable dining. Simplified ordering, full traceability, responsible farms - we connect chefs with tomorrow's agriculture, combining impact, transparency, and performance.",https://www.promus.fr,
Proppl,startup,,"Proppl is a sourcing and recruitment solution based on external referrals.

Its mission:
-Help companies recruit better and faster.
-Empower those who recommend top talent from their networks.

Simple, effective, and fair. A vision where everyone wins.",https://www.proppl.io/,
PROSPEAK AI,startup,,"Design high-performing Meta ads in a flash with AI-generated visuals and copy. Let our Messenger chatbot handle lead engagement and appointment booking — a full-funnel, automated sales assistant in your pocket.

Register now on https://prospeak.ai/",https://prospeak.ai/,
PRUM Leap Technologies PTE. LTD.,partner,,"PRUM Leap Technologies is a micromobility company revolutionising urban transport with the CTPOD One, a sustainable, electric three-wheeled pod designed for sustainability, safety, comfort, and accessibility.",https://www.prumleap.com/,
Pruna AI,startup,France,"The easiest way to optimize GenAI inference.

Pruna eliminates the overhead of model optimization and helps you ship fast, high-performance models.

The result? You unlock better margins, ship faster models, and make happier users.",https://www.pruna.ai/,
Psynarios,startup,,Virtual role-plays designed by psychiatrists to transform workplace behaviors and relationships at scale. We offer a unique safe space to experience realistic AI-powered situations that mirror your daily challenges while guided by scientific research. ,https://www.psynarios.com,
Public IA,startup,,"Public IA designs artificial intelligence solutions for public sector decision-makers, with the goal of enhancing their ability to anticipate, decide, and act, by leveraging complex, relevant, and contextualized data.",https://www.public-ia.fr,
PUBLICIS GROUPE,partner,,"Publicis Groupe is a global leader in communication, positioned at every step of the value chain, from consulting to execution, combining marketing transformation and digital business transformation, through a powerful alchemy of creativity and technology",https://france.publicisgroupe.com/a-propos/,
Publicis Production,partner,," As Publicis Groupe’s production platform, we connect 5,200 specialist talents across 50 locations worldwide in over 200 markets.
 
Consumers expect a personalized flow of content in their preferred channels, exactly when they need it. Brands are confronted with reduced budgets, increased waste, and the revolution of AI and automation, leading to confusion and an inability to adapt at pace. This leaves them asking: what is the right direction forward? At Publicis Production, we see an opportunity to disrupt the status quo and transform production spend into business growth. By combining over 100 years of creative experience with Publicis’s unparalleled access to data and cutting-edge AI-powered technologies, we are remodeling from cost-driven to value-based. The result: intelligent content.",https://publicisproduction.com,
Puglia Region,partner,,"Located in Southern Italy, Puglia is a dynamic region where rich history meets cutting-edge innovation and exceptional quality of life. Through its ambitious regional strategy, #mareAsinistra, Puglia Region attracts international talent and investment while fostering sustainable growth in highly innovative sectors such as sustainable manufacturing, human health and environmental systems, and inclusive digital communities.

The region’s entrepreneurial ecosystem boasts 544 innovative startups, 138 innovative SMEs, 4 certified incubators, and 5 universities that foster groundbreaking research and technological development. Puglia is emerging as a strategic location for business and investment, offering incentives for startups, SMEs, and multinational companies seeking to expand their operations in the heart of the Mediterranean.",https://www.arti.puglia.it/,
PulpoAR,startup,,PulpoAR is a leading beauty tech company specializing in augmented reality (AR) and artificial intelligence (AI) solutions for the beauty industry. ,https://www.pulpoar.com,
Punto Health,startup,UK,"Punto Health connects patients, families and providers through an AI-powered platform facilitating continuous and personalized support. From mild cognitive impairment to more advanced dementia stages, we provide a trusted companion along the way.",https://puntohealth.com,
Purpl,startup,,"Purpl is a digital wallet that makes it easy, secure, and affordable to receive money, pay locally, and manage funds. Built for the Middle East, starting with Lebanon. Simple. Borderless. Financially empowering.",https://purplme.com/,
Purple Alternative Surface,startup,,"Purple transforms hard-to-recycle plastic waste into eco-friendly, permeable paving for sustainable parking. Our mission: decarbonize construction, reduce soil sealing, and promote local circular economy with on-site mini-factories.",https://www.purplealternativesurface.com,
PURPLE ALTERNATIVE SURFACE,startup,,"Purple transforms hard-to-recycle plastic waste into eco-friendly, permeable paving for sustainable parking. Our mission: decarbonize construction, reduce soil sealing, and promote local circular economy with on-site mini-factories.",https://www.purplealternativesurface.com,
PUSH,startup,,"PUSH, a fintech driving financial inclusion and transforming agricultural value chains on the African continent.",https://www.push-ci.com,
PwC,partner,,"At PwC, we help clients build trust and reinvent so they can turn complexity into competitive advantage. We’re a tech-forward, people-empowered network with more than 370,000 people in 149 countries. Across audit and assurance, tax and legal, deals and consulting we help build, accelerate and sustain momentum. Find out more at www.pwc.com.",https://www.pwc.fr/fr/vivatech.html,
PYCLA,startup,,"PYCLA was founded on the belief that technology only matters when it focuses on people. By combining diverse expertise, its founders create practical solutions to help companies become more agile, efficient and competitive.",https://pycla.com/,
QAIrbon,startup,,"We provide reliable, near-real time data on CO2 emissions and on industrial activity of steel, aluminium and energy sectors. We proceed by measurement from space, directly at the scale of the industrial sites, worldwide.",https://www.qairbon.com,
Qairnel,startup,,"Qairnel is a spin-off from the Brain Institute and Inria, dedicated to accelerating the development of new treatments for neurodegenerative diseases by reinventing how clinical trials are designed and conducted. Using AI, we identify the right patients.",https://qairnel.com,
QALISA,startup,,"Qalisa develops Ivy for companies that want to work together to perform better. Ivy is an application that breaks down biases to encourage discovery and sharing between all employees, so that everyone can find their place. ",https://qalisa.fr,
QAP Computing,startup,,QAP Computing is a quantum software company that leverages the exponential capabilities of quantum computing to accelerate high-performance computing and data analysis applications.,https://www.inria.fr/en/startups-resulting-inria-saclay-centre,
Qarnot Computing,startup,,"Qarnot is reshaping European HPC with an intuitive HPCaaS platform for engineers in aerospace, energy, automotive, and naval sectors. It delivers seamless, high-performance computing for R&D teams—without IT complexity or traditional infrastructure costs.",https://hpc.qarnot.com,
Qatalyst,startup,,"Qatalyst is an investor-centric project due diligence platform that radically improves the way investors identify, evaluate & invest in the full range of carbon offset projects, allowing them to invest faster and at scale.",https://www.qatalystcarbon.com/,
QbitSoft,startup,,"Our mission is to make quantum technology accessible today, enabling our customers to solve complex mathematical problems that are beyond the capabilities of existing technologies.",https://www.qbit-soft.com,
qCella AG,startup,,"qCella (re)shapes product heating in transportation, machines & for personal heating. Our shape-customizable, paper-thin & homogeneously heating mats render the heating of car seats, car interiors, machines, shoes and pain relievers more energy-efficient.",https://qcella.com,
QFLUIDICS,startup,," Qfluidics is revolutionizing the chemical and pharmaceutical industries with its liquid tube technology, drastically reducing costs and environmental impact while enhancing industrial competitiveness.",https://www.qfluidics.com,
Qibud ,startup,,Feel the rush as your company outpaces competitors. Qibud turns team struggles into powerful results that matter. Goals become certain wins as key decisions become clear. Watch your team shine as your company reaches new heights,https://www.qibud.com,
Qolaig,startup,France,"Supercharge your business with custom AI agents. Qolaig helps you automate workflows and repetitive tasks fast, smart, and tailored to your needs. Qolaig helps you create custom AI agents to automate your business processes.
 ",https://www.qolaig.com,
Qperfect,startup,,"QPerfect, a spin-out from the European Center for Quantum Sciences in Strasbourg, France, is exhibiting at Vivatech. Specializing in quantum simulations and error-correction in the advancement of fault-tolerant Quantum Computing.",https://qperfect.io,
QPerfect,startup,,"QPerfect is a spin-out from the European Center for Quantum Sciences from Strasbourg, France. Specializing in quantum simulations and error-correction in the advancement of Fault-tolerant Quantum Computing. 
 ",https://qperfect.io,
QReserve,startup,,"QReserve is a Canadian company that provides organizations with powerful enterprise-grade scheduling and resource management software to manage their valuable equipment, consumables, spaces, services, and people. 
",https://get.qreserve.com/,
QRQS.eu,startup,,"We specialize in automation, digitalization, and robotization. Our goal is to transform complex business processes into efficient digital ecosystems, enhancing reliability and performance across industries.",https://qrqs.eu,
QUADTECH,startup,France,"QuadTech provides turnkey, sovereign AI solutions, customized to your business. Our SaaS platform and cloud expertise accelerate digital transformation, efficiently implement AI projects, and ensure a seamless, secure Move to Cloud. ",https://www.quadtech.fr,
Qualisteo,startup,,"Qualisteo est une entreprise innovante spécialisée dans la mesure, le suivi et la réduction des consommations énergétiques des sites industriels.",https://www.qualisteo.com/,
Quandela,startup,,"Quandela is a leading quantum computing company that designs, builds, and delivers industry-grade quantum computing solutions.",https://www.quandela.com,
QuantCube Technology,startup,France,"QuantCube Technology uses AI and big data analytics to deliver real-time macroeconomic insights. Our clients benefit from real-time macro insights, ahead of official numbers, which they can use to inform their investment strategies.",https://www.quant-cube.com/,
QuanTech,startup,,"QuanTech Solutions is a consulting and technology firm specializing in the development of innovative solutions through advanced technologies, helping companies optimize their processes and drive digital transformation. #ITAdvisory #ProblemSolver #IA #Data",https://www.quantech.solutions,
Quantexa,startup,UK,Quantexa delivers an AI-powered Decision Intelligence Platform supporting multi-use case solutions and enabling confident decision-making and enterprise-wide transformation at scale. Quantexa provides new insight by unifying and contextualizing the data. ,https://www.quantexa.com,
QuantiCor Security GmbH,startup,,"QuantiCor Security is at the forefront of developing cutting-edge security solutions. QuantiCor provides its award-winning and quantum-safe cybersecurity platform PQVault, recognized with the IT Security Award.",https://www.quanticor-security.de,
QuantPi GmbH,startup,,"QuantPi offers an AI trust platform that unifies testing and governance, accelerating time-to-value and enabling responsible, scalable AI oversight—cutting costs, reducing engineering time, and improving control across an organization’s AI landscape.",https://www.quantpi.com/,
Quantum Optics Jena GmbH,startup,,"Quantum Optics Jena is a worldwide leader in entanglement-based key distribution systems & quantum-safe encryption solutions. We design, deliver, and deploy quantum systems for telecommunication networks, critical infrastructures, and defense institutions",https://www.qo-jena.com,
Quatre fevrier,startup,,"Free and secure, Quatre Fevrier is a web app designed to support cancer patients and their loved ones at every stage of the journey - from awaiting diagnosis to life after cancer. It provides both practical and emotional support.",https://www.quatrefevrier.com,
Qubit Pharmaceuticals,startup,France,"Qubit Pharmaceuticals, a deep tech-bio company at the forefront of quantum science, artificial intelligence, and high-performance (classical, exascale and quantum) computing has developed portfolio of drug discovery assets in oncology and immunology.",https://www.qubit-pharmaceuticals.com/,
Qubitrium,startup,,"We share your excitement for the second quantum revolution. We develop and produce advanced, miniaturized quantum solutions for cryptography, communication and sensing, and provide integration services to bring them to industry.",https://qubitrium.tech,
Québec Tech,partner,,"Québec Tech is a non-profit organization dedicated to economic development. Its aim is to increase the number of successful Quebec technology startups that go international, and to accelerate their development by mobilizing the key players in the Quebec entrepreneurial ecosystem. How do they do this? By stimulating the local and international commercial success of products developed by Quebec tech startups.",quebectech.com,
QUEHORA,startup,,Quehora est une app mobile qui génère des itinéraires touristiques optimisés selon l’affluence et la météo pour gagner du temps pendant les visites. Elle développe aussi des widgets de prévision d’affluence destinés aux acteurs B2B.,https://quehora.app/,
QUIDEOS,startup,France,"Quideos provides tailored price coverage for all agricultural products, helping farmers, cooperatives, and agri-food companies secure their margins and plan investments with confidence, across the entire value chain. ",https://about.quideos.com,
QUIET,startup,,"QUIET, the world’s first silent tableware line, is revolutionizing collective catering. Made with tempered glass and silicone, it significantly enhances the daily lives of the staff who care for our children, seniors, and patients. ",https://www.getquiet.co,
QUIPU AI,startup,,"QUIPU AI weaves Digital Threads—semantic pathways that trace real-world entities and their relationships—into a unified knowledge fabric, enabling smarter discovery, deeper analytics, and context-aware Agentic AI across the enterprise.",https://www.thequipu.com/,
Quitus,startup,,"Intelligent SaaS platform for biometric school attendance with a parental notification system and real-time SMS alerts, with a patent in 17 countries.",https://quitus.tech,
QunaSys,startup,Japan,"QunaSys is a start up company dedicated to advancing algorithms and platform agnostic software solutions for quantum computing especially in the field of chemicals, materials, energy, manufucturing, pharmaceuticals and beyond.
",https://qunasys.com/en/,
Quobly,startup,,"Quobly leverages semiconductor innovation to unlock the potential of quantum technologies. Utilizing established transistor fabrication methods, Quobly aims to create scalable and cost-effective quantum processors. ",https://www.quobly.io,
Quwak,startup,Japan,"We are a company that empowers individuals to prove, in their own way, that they are human and unique — in an era where AI and humans coexist.",https://quwak.com/?lang=en,
R8 Technologies OÜ,startup,,"R8 Technologies drives commercial real estate sustainability with AI-powered automation. Our Digital Operator Jenny decarbonizes buildings, meets standards, with no extra hardware needed, delivering economic and environmental benefits.",https://r8tech.io/,
Radiant Matter,startup,UK,"Radiant Matter is pioneering bio-inspired, non-toxic, and biodegradable colour-effect materials from cellulose. Using nature’s ingenuity, we create vibrant structural colours without plastics, metals, minerals, or pigments, as a low-carbon alternative",https://www.radiantmatter.co,
Ragmetrics,startup,,"RagMetrics is a platform for evaluating large language model (LLM) applications, including retrieval-augmented generation systems. It helps teams prove ROI and optimize performance through automated, tailored and scalable evaluations.",https://ragmetrics.ai/,
Raidium,startup,France,"Raidium is developing the first 3D multimodal foundation model for precision radiology, delivered to radiologists in an AI-native PACS viewer. The initial use cases focus on clinical trial biomarkers in oncology, before expanding to the entire workflow.",https://www.raidium.eu/,
RAIKU Packaging,startup,,"100% natural, beautiful and shock absorbing packaging material. We are supported and funded by EIC Accelerator, and part of Louis Vuitton Moet Hennessy accelerator, showcasing that our technology is considered strategic to reduce the packaging waste.",https://www.raiku.co,
RAIlwAI,startup,,RAIlwAI (aka RAIL with AI) is a data driven solution focusing on Rail Infrastructure Predictive Maintenance. Leveraging all available data with a clear ROI: Reducting maintenance cost by 15% while improving infrastructure availability by 30%.,https://www.railwai.com,
Random Power,startup,,"Random Power delivers quantum-grade randomness via a FIPS-140-3 compliant QRNG platform, enabling secure encryption and privacy across data centres and IoT with industry-leading entropy. Its products are the cornerstone of quantum resilience.",https://www.randompower.eu/,
RandomCoffee,startup,France,"The smart connection layer for your company! It enables coffee chats, mentoring, onboarding and collaboration through automated rituals. Meaningful connections are built across locations and teams for a more connected, inclusive and performing workplace.",https://www.random-coffee.com,
RATP GROUP,partner,,"Innovation, a strategic lever for performance and competitiveness, is embedded in the DNA of the RATP Group. As a partner to cities and territories, the Group innovates daily to offer increasingly accessible and sustainable mobility solutions, enrich the passenger experience, strengthen its industrial leadership, and improve the quality of life at work for its employees. VivaTechnology, a major event in technological innovation organized in its ""historical cradle,"" is an unmissable opportunity to share our innovations and meet potential partners.",https://ratpgroup.com/en/,
RAWA  | Emirati Wellness,startup,,"RAWA is an Emirati wellness brand rooted and enriched by the natural power of date seed oil. Inspired by the UAE’s landscape, flora and scents, we offer premium wellness products: candles soaps, and body butters designed for mindful self-care. ",https://www.instagram.com/emirati_wellness/,
RAYIONE,startup,,Give a second life to electric vehicle batteries to provide a modular energy reserve.,rayione.com,
RDC - ACORISS S.A.R.L,startup,,Retail & E-commerce Consulting & B2B services Fintech and Banking.,https://www.acoriss.com,
RDI Irrigation,startup,,,,
