CompanyName,Category,Country,Description,Website,LogoURL
.lumen,startup,,".lumen builds pedestrian autonomous driving AI (PAD AI), first showcased in the Glasses for the Blind.",https://www.dotlumen.com,
10kM.ai,startup,,"Our engine instantly absorbs your brand DNA to generate stunning, on-brand corporate videos—fast. Start with anything: text, websites, images. Then dive into our mobile-first editor to polish it to perfection. Backed by 16 PoCs and CES Innovation Award. ",www.10km.ai,
1km à pied,startup,France,"We help cities analyze their home-to-work traffic flows by conducting mobility audits of the largest employers and measuring the impacts of alternatives. We are already the tool used by Strasbourg, Rennes, Tours, La Rochelle...",https://www.1kmapied.com,
1km à Pied,startup,,"We help multi-site organizations reduce their field employees' commute distances by enabling job swaps and internal mobility to closer sites. Our clients (La Poste, SNCF, Lidl, Auchan, Korian...) cut CO2 emissions, employee fatigue, and absenteeism. ",https://www.1kmapied.com/,
26lights,startup,,"26lights supports growing start-ups, scale-ups and SMEs  achieve sustainable and scalable growth with tailored plans working on Business, Tech, and Growth Marketing. We have worked with about 150 companies for the last 13 years.",www.26lights.com,
2Be-FFICIENT,startup,,"2Be-FFICIENT helps top enterprises deliver seamless digital experiences. Our AI-powered monitoring detects real-time issues across web, mobile, APIs, SVI, chatbots, voicebots and thick clients, by simulating actual user actions 24/7 on real devices.",https://www.2befficient.fr,
2NZENA STUDIO,startup,,"2nzena is an audiovisual company based in Mayotte, specializing in recording, live broadcasting, and the production of cultural, sports, and event content.

Since 2024, 2nzena has launched Yatru, a 100% digital media outlet dedicated to sports.",https://2nzenastudio.fr,
2Tonnes,startup,,"What if the ecological transition was the key to tackling 21st century challenges?   To face today's crises without exceeding planetary limits, let's rethink how we act! 2tonnes creates immersive workshops to understand, act, and build collective power.",https://www.2tonnes.org,
365Talents,startup,,"365Talents, the leading AI-powered solution, transforms HR by seamlessly mapping skills for industry giants like EY, SLB, Veolia, SocGen (and others!), ensuring they future-proof their talent strategy and embrace a Skills-based Organization approach.",https://365talents.com,
369sonic s.r.o.,startup,,"We specialize in the production and sale of ultrasonic cutting tools such as wireless electric ultrasonic kitchen knives and cutters. The built-in transducer moves the blade of the knife 40,000 times per second, which amplifies the cutting properties.",https://eshop.369sonic.com,
3D Biotechnology Solutions - 3DBS,startup,,"3DBS is a Brazilian startup that develops in vitro tissue models and biofabrication equipment. Supported by FAPESP, FINEP, and São Leopoldo Mandic, it enables animal-free testing and innovation in personalized medicine and regenerative research.",http://www.3dbiotechnologiessolutions.com/en/home-english/,
3D MINERALS,startup,,3D Minerals conçoit et développe des IMPRIMANTES 3D CÉRAMIQUES avec une technologie d'extrusion innovante et brevetée : Slurry Deposition Modeling. Cette innovation permet d'imprimer en 3D des pièces de grandes dimensions en continu.,https://www.3d-minerals.com/,
3DVarius,startup,,"3Dvarius designs and manufactures high-end electric violins using 3D printing technology. Made in France, 3Dvarius blends precision, innovation, and artistry to offer unique instruments for modern violinists seeking new soundscapes.",https://www.3d-varius.com/,
4 Earth 2 Mars Holding B.V.,startup,,"At 4 Earth 2 Mars, we develop CATs&DOG — a modular building system combining AI, geometry, origami, and circular design to enable off-grid construction anywhere, even in extreme environments. It includes design software, portable units, and DIY tools.",https://www.4earth2mars.com/,
40WATTS CYCLES,startup,,"40Watts extends the life of electric bikes by reconditioning and repairing batteries using advanced automation - enabling smarter, more sustainable mobility.",https://40Watts.fr,
4Division,startup,,"4DiVISION is a leading company in autonomous manufacturing and smart factory solutions, providing high-quality automation solutions through its proprietary 3D sensors and on-sensor AI technology.",https://4division.quv.kr,
Aalia.Tech,startup,France,"Overcome language barriers in healthcare with AaliaTalk, our Al-based smart voice assistant that facilitates communication between healthcare providers and patients, while considering cultural and medical contexts. Available on iOS, Android and WebApp.",https://www.aalia.tech,
AB Corp,startup,,"Thrustore accelerates e-commerce brand growth with expertly-crafted productized services. From strategy to product listing optimization, we enable sellers to achieve measurable, scalable results with proven frameworks, executed by experts and agents. ",https://thrustore.com,
Abbott,partner,,,,
ABOUT Ü,startup,,"About ü is reinventing executive hiring with a vetted pool of top-tier talent in active, confidential search. Efficient, bias-free, and impact-led — because leadership diversity isn’t a bonus. It’s a competitive edge.",https://aboutu.fr/,
Absolute Labs,startup,USA,Absolute Labs is an AI-powered Web3 driven customer engagement platform that enables brands to unlock incremental revenue streams from crypto-savvy consumers. ,https://absolutelabs.io/,
Absys Cyborg,startup,,"Absys Cyborg advises companies in all sectors on choosing, deploying and integrating solutions for management, ERP, CRM, Reporting, Business Intelligence and Cloud.",https://www.absyscyborg.com/en,
Abyssale,startup,France,"Abyssale is an AI-powered platform that helps Agencies and Marketers generate banners and visuals at scale for ads, emails, print campaigns and social media. We automate creative production to save time and boost performance.",https://www.abyssale.com,
ACCELCITY,startup,,"AccelCity is a Moroccan startup using AI & IoT to help motorists find and pay for available parking spots. Our solution eases traffic, cuts emissions, and supports smart city goals. We seek partners and investors to scale across Europe and Morocco 2030",https://AccelCity.com,
Acceptable,startup,,"Quote, sign and charge for your digital services quickly and securely",https://acceptable.legal/en/,
AccessOff,startup,,"Are you suffering from sharing Passwords?
AccessOff lets teams securely share digital accounts without passwords. Customize access levels, track activity, and revoke instantly—full control, full visibility, fully flexible.",https://accessoff.io/,
Acecore Incorporations,startup,,"Acecore indigenously builds AI-powered solar energy systems to solve Africa's issues with unreliable electricity and fossil fuel dependence, offering modular, all-in-one clean energy solutions for homes and businesses.",https://www.acecore.tech,
Achille.ai ,startup,France,"Achille.ai reinvents customer service with a hybrid model: expert human agents + generative AI. It drafts or automates replies, learns from every answer, and delivers faster, brand-aligned support. ",https://www.achille.ai/,
Acquire to Decide (A2D),startup,,Software and applications for infrastructure inspection and monitoring.,https://www.a2d.ai/,
ACTIVE ASSET ALLOCATION,startup,,"Active Asset Allocation is a FinTech company that empowers asset managers, insurers, and distributors to optimize savings solutions. Our cloud-based platform Coanda, leverages AI and calculation APIs to streamline operations and enhance client engagement.",https://active-asset-allocation.com/fr/,
ActuIA,partner,,"ActuIA is France’s first media outlet entirely dedicated to artificial intelligence. We provide in-depth coverage of AI research, industry trends, and the societal impacts of intelligent technologies through articles, newsletters, and a quarterly printed magazine.

As a trusted source for professionals, researchers, and decision-makers, ActuIA bridges the gap between innovation and application. Our editorial team works closely with academic labs, startups, large corporations, and public institutions to deliver accurate and actionable insights.

What We Offer:

A quarterly magazine distributed in France and abroad
A daily news website with over 1 million weekly pageviews
A daily newsletter followed by top AI professionals
Custom content & advertising formats for tech companies and institutions
Looking for Partnerships With: AI startups, research labs, event organizers, tech companies.",https://www.actuia.com,
Acumino,startup,,"Acumino offers next-generation, AI powered robot workers for the execution of highly dexterous tasks in industrial automation settings. The Acumino AI is trained on the most accurate data of robot interactions and unlocks unmatched robot dexterity & ROI. ",http://www.acumino.ai,
AD'OCC - Région Occitanie,partner,,"Welcome to AD'OCC, your engine for economic development in Occitanie!

With 180 experts spread over 72,000 km², we can help your business succeed thanks to our AD'OCC 360° approach. Financing, export, innovation, location: we offer tailor-made solutions for every stage of your project.

Thanks to our in-depth knowledge of local sectors, we can offer you solutions tailored to your specific needs. Together, let's create new opportunities and succeed in Occitanie!",https://www.agence-adocc.com/vivatech/,
Ada Coffre,startup,,"Clésame is the future leader in death tech. Clésame automates estate management and digital death through a platform designed with notaries. Data centralization, secure transmission, and account termination: inheritance made simple.      ",https://www.clesame.fr,
Adaptive ML,startup,USA,"Adaptive Engine is a reinforcement learning platform that enables enterprises to fine-tune, evaluate and serve the best LLMs for their business. Deploy reliable AI agents that outperform proprietary LLMs, reinforcement fine-tuned using synthetic data.",https://www.adaptive-ml.com/,
ADCIS - Groupe Evolucare,startup,,"ADCIS specialized in image processing & analysis. A key player in the field of Computer Vision, ADCIS publishes Aphelion, an industrial image processing software, contributes to research projects and develops specialized applications for its customers...
",www.adcis.net,
ADD Accounting softoware,startup,,"A cloud app. assists you to manage all accounting transactions.  ADD accredited from ZACTA within the electronic invoicing service providers approved list for E- invoice, provide Sales Management such invoicing, quotations, and customer accounts.",https://addaccounting.com/,
addd Inc.,startup,,"Founded in 2018, addd Inc. is a Korea-based marketing agency specializing in AI and computer vision. We focus on transforming offline advertising into measurable media through data-driven innovation, with a vision to lead the future of intelligent OOH ad
",https://addd.co.kr/?lang=english,
ADIM - Agence de Développement et d'Innovation de Mayotte,partner,,"The Mayotte Agency for Development and Innovation (ADIM) is a public agency dedicated to supporting economic growth, innovation, and territorial development in Mayotte. Its mission is to identify and foster high-potential projects, strengthen the local entrepreneurial ecosystem, and promote sustainable development across the island. ADIM acts as a bridge between public authorities, private stakeholders, and local communities, facilitating collaboration and funding opportunities. Through tailored support programs, strategic partnerships, and innovation-driven initiatives, the agency plays a key role in transforming Mayotte’s challenges into opportunities for inclusive and resilient growth.
For more information, please contact us: poleinnovation@adim-mayotte.fr",https://www.adim-mayotte.fr/,
Adin AI,startup,,"ADIN.AI is an AI-native, holistic media planning & execution platform built for enterprises to take full control of their advertising efforts & investments. Advertisers can eliminate inefficiencies, increasing transparency, and maximizing ROI.
",https://www.adin.ai,
Admir,startup,,"Cancer is complex and unique to each patient, requiring accurate, personalized diagnostics. ADMIR offers high-throughput infrared imaging and deep learning-based analysis to visualize and map cellular metabolism in biopsy samples.",https://www.admir-analysis.com/,
ADOBE,partner,,"Adobe empowers everyone, everywhere to imagine, create, and bring any digital experience to life through its leading technologies. Adobe is uniquely positioned to bring together content and data to address the insatiable demand for personalized customer experiences. No other company has built a foundation like ours.  
 
From the debut of PostScript, the introduction of Photoshop, the invention of PDF, and the creation of the digital marketing software category to our latest transformative innovations, Adobe is changing the world through personalized digital experiences. ",https://business.adobe.com/fr/,
Adsrank,startup,,"Adsrank is a Google Ads agency, Google Partner certified, dedicated to helping ambitious small and medium-sized businesses grow. Founded in 2019, our team of 15 experts combines human expertise with AI-powered technology to build high-performing campaigns.",https://www.adsrank.fr,
Advanced Resonance Kinetics SA,startup,,"Discover ARK Crystal, a revolutionary technology rooted in unified physics that harnesses electromagnetic quantum vacuum fluctuations. With precision engineering, it interacts with your energy to boost vitality, clarity, and balance—promoting well-being.",https://www.arkcrystals.com,
Advizeo ,startup,,advizeo propose des solutions innovantes pour maximiser les économies d'énergie des entreprises et collectivités. La société met la Datascience et l'IA au service des Energy Managers qui pilotent plus efficacement l'énergie des bâtiments. ,https://www.advizeo.io/,
Aegis Technologies,startup,,"Aegis Technologies is a software editor providing innovative technologies to extract, structure and enrich data automatically in your analysis tools. Our modular approach enables integration in any system, as data flow, investigations or data normalization.",https://aegis-technologies.fr,
AELER Technologies,startup,,"AELER reinvents the shipping container. Made from advanced composite materials, offering unmatched strength, insulation, durability, protecting cargo and reducing CO2 emissions for cargo owners. Integrated IoT sensors and security enable end-to-end monitoring.",https://aeler.com,
AEMOTION,startup,,"Get back your freedom !

In a world where mobility feels stuck between congestion and compromise, ÆMOTION breaks free.

Discover the new vehicle that merges true motorbikes' agility with the safety of a car.

ÆMOTION. Drive Bold. Move Smart.",https://ae-motion.com,
AeonX AI SAS,startup,France,"AeonX AI is a deep tech and data security company specializing in AI and quantum-safe cryptography. Their products include BLAZE Quantum, offering E2EE secure file transfer, and nVie, a private AI assistant.
",https://aeonx.ai,
Aerleum,startup,,"Aerleum turns CO₂ into synthetic fuel using a unique reactor that merges capture and conversion. We aim for fossil fuel price parity to accelerate the shift to net-zero fuels in aviation, maritime, and other hard-to-abate industries.",https://aerleum.com,
Aevy,startup,,"Aevy supercharges asset management and due diligence by automatically extracting information from your documents, unlocking a step-change in asset management and due diligence of onshore wind and utility solar assets.",https://aevy.io,
Afflo Transplant Management,startup,Canada,"Afflo delivers a configurable platform that streamlines organ transplant workflows, enabling hospitals to enhance efficiency, achieve excellence, and become global leaders in organ transplantation. ",https://www.afflo.io/,
Africanews,partner,,"Africanews is the only pan-African news media delivering the latest national, regional, continental news 24/7 in French and English languages. Africanews adheres to the same editorial charter as its sister channel Euronews guaranteeing its independence and impartiality.  

Africanews is on a mission to tell African stories from a pan-African perspective, inspiring people to share their opinions and making their voice resonate. Africanews addresses 40M homes in Africa and beyond (USA, UK). Africanews reaches 3.7M African Affluent , offering its unique take on current affairs to opinion leaders or business decision maker. Since 2016 we are committed to changing the African narrative and connecting the continent and the diaspora. ",https://www.africanews.com/,
AfricaTech Lab,partner,,"The AfricaTech Lab, organised by Viva Technology is the place where the African Continent meets with the world. by inviting 9 startups, finalists of the AfricaTech Awards, and hosting a live Stage for all African thematics, this is the place to B2B.",https://vivatechnology.com/,
Africharger,startup,,AFRICHARGER is a pioneering Ivorian company deploying electric vehicle charging infrastructure and battery swapping stations to accelerate green mobility across West Africa.,https://africharger.com,
AFTERDATA,startup,France,"AfterData, ranked among the top 100 RegTechs, offers a next-gen compliance solution using machine learning and micro-segmentation to fight money laundering, terrorist financing, and market abuse, while reducing false positives and improving detection.",https://www.afterdata.com,
AFX54,startup,France,"AFX54 is the hub for African creators - the premier digital platform dedicated to all passionate individuals and talents seeking to amplify their voices, showcase their projects and connect across the continent and African diasporas worldwide.",https://afx54.com/,
AG Partners,partner,,"AG PARTNERS PUBLICIS AFRICA is a 360° strategic communications agency with a Pan-African vision. We support brands, institutions, and organizations in designing and deploying tailored strategies that blend cultural insight, creativity, and impact. From brand positioning and digital activation to public affairs and media relations, our integrated approach ensures coherence and relevance across all touchpoints.",https://www.ag-partners.com/RWD/fr/groupe.php,
AGE IMPULSE,startup,France,"1 in 4 seniors aged 65+ falls each year, a leading cause of injury-related deaths among the elderly. We created Gaitwin©: an award-winning, patented Digital Gait Twin to assess fall risk in just a few steps via a wearable sensor and AI. Deployed in B2B.
",https://age-impulse.com/,
Agence de l'innovation pour les transports,partner,,"The Transport Innovation Agency (AIT) was created by the Minister in charge of Transport in November 2021.
Its mission is to support the mobility ecosystem in meeting the major challenges of transforming our transport systems through innovation: ecological transition, territorial cohesion, resilience, and digital transformation. AIT is driven by the DGITM, DGAC, and DGAMPA.
Propulse is AIT’s flagship program, designed to support and accelerate the most promising innovations — whether technological, social, organizational, industrial, or related to services and user practices.
The program is backed by State services, ensuring strong momentum for acceleration.",https://www.ecologie.gouv.fr/politiques-publiques/agence-linnovation-transports,
Agence Économique Régionale de Bourgogne-Franche-Comté,partner,,"The Bourgogne-Franche-Comté Regional Economic Agency was created on 1 October 2017 by the Bourgogne-Franche-Comté Regional Council and contributes to the development of the region’s economy. It assists companies and regions.

Its strategic objectives are:

- To assist in maintaining and developing economic activity and employment in the region,
- To develop innovation, ecological transition and energy recovery;
- To support the economic development policy, implementing it regionally according to needs,
- To promote the region’s economic appeal.

The Bourgogne-Franche-Comté AER (Regional Economic Agency) provides services aimed at:

- Businesses (Industry, Services to industry, Start-ups)
- Local government areas of the region, i. e. its eight administrative departments",https://aer-bfc.com/,
Agence Nationale de la sécurité des systèmes d'information (ANSSI),partner,,"Created in 2009 as part of the Prime Minister’s Office, the French Cybersecurity Agency (ANSSI) is the national authority in matters of cybersecurity and cyberdefence. ANSSI is responsible for coordinating the defence and protection of information systems. As such, the Agency’s primary objective is, to construct and organise the protection of the country from cyberattacks and to contribute to the stability of the cyberspace. ANSSI’s work revolves around five main missions:
-	Defending critical information systems and the victims of large-scale cyberattacks;
-	Being familiar with the state of the art in cybersecurity and with cyberspace threats;
-	Sharing knowledge, recommendations, and expertise in digital safety;
-	Assisting the national and international ecosystem;
-	Regulating cybersecurity organisations, goods, and services.",https://cyber.gouv.fr/,
Agence Universitaire Innovation,startup,,"AUI TECHNO designs solar-powered, connected incubators tailored for Africa. Over 200 units are already operating in 7 countries, saving 3,000+ lives. Our goal: deploy 600,000 units to protect every newborn across the continent.",https://www.aui-techno.africa,
Agenz,startup,,"Nous inventons le futur de l'immobilier au Maroc, pour aider chaque personne à vendre et acheter les yeux fermés.

",https://agenz.ma,
AGILOX Services GmbH,startup,,We have reimagined Automated Guided Vehicles (AGVs) from the ground up and see our robots as a revolutionary development of AGVs. The intelligence of our material handling robots avoids investments in infrastructure.,https://www.agilox.net/en/,
"Agnavi Co., Ltd.",startup,,"Agnavi is promoting its original Japanese sake brands, ICHI-GO-CAN® and Canpai®, both are 180-milliliter cans of sake to enjoy smaller size, stylish, and handy alcoholic beverages. Creating new markets to innovate sake lovers' lifestyle.",https://agnavi.co.jp,
AGON,startup,,"Agon utilise la réalité virtuelle pour renforcer les capacités cognitives. Ses entraînements s’adressent à tous en développant attention, réactivité et gestion du stress, essentiels à tout âge et dans tout métier. ",https://agon-league.com/,
Agora Labs,startup,,"Agora Labs creates mathematically anonymized datasets for real-world studies and clinical AI, using federated learning for real-time access to global data networks. Its agentic LLMs extract and standardize previously inaccessible clinical information.",https://www.agoralabs.eu/,
Agorize Bloomflow,partner,,"Agorize and Bloomflow are shaping the future of how enterprise organizations innovate and grow. 300+ companies trust Agorize and Bloomflow, including L'Oréal, HSBC, Capgemini, Unilever, Generali, Pepsico, and Microsoft.

🔹 Agorize is the leading solution to launch innovation programs at scale. Through open innovation challenges, hackathons, and intrapreneurship initiatives, Agorize helps organizations engage with startups, students, and employees to source and develop bold new ideas—globally and efficiently.

🔹 Bloomflow is the leading software to drive innovation-led growth. With a focus on strategy execution, Bloomflow enables innovation teams to align priorities, manage global portfolios, and accelerate the rollout of impactful initiatives.

Together, they offer a comprehensive approach to innovation—from sourcing ideas to scaling outcomes—empowering organizations to stay ahead.
",https://get.agorize.com/,
Agri Minga,startup,,"AgriMinga is an AgriTech company that uses IoT, and data analytics to optimize farming, improve crop yields and promote sustainability.",https://agriminga.com,
Agrimage,startup,,"AGRIMAGE SAS is a consulting and support firm operating across the entire agricultural value chain, from land acquisition (Tontine tool) to third-party management and marketing (Sen AgriMarket).",https://agrimagesas.com/,
Agyre,startup,,"Agyre is an engineering office working to develop and deploy the circular economy within the construction sector. Its comprehensive approach is based on 3 scopes: trainings, operations and innovations. ",https://www.agyre.com/,
AI Cargo Foundation,startup,France,"AI Cargo is a government-funded association in France developing a sovereign AI platform and digital solutions to decarbonise logistics. Focus areas: long-distance transport, urban logistics, fleet transition, and accurate freight carbon tracking.",www.aicargofoundation.org,
AI Network of BC,partner,,"The AI Network of British Columbia (AInBC) is the industry association for artificial intelligence in BC, dedicated to advancing the province’s AI ecosystem. We connect startups, scaleups, researchers, investors, and public sector leaders to foster innovation, drive commercialization, and support responsible AI adoption. Through strategic partnerships, events, and advocacy, AInBC serves as the central hub for AI industry growth across British Columbia.
",https://ainbc.ai,
AI Planet,startup,,"Enabling enterprises to build and deploy autonomous AI agents using a secure & reliable full-stack GenAI platform. Thriving on 300k+ global AI community, our larger vision is to make AI accessible for everyone.",https://aiplanet.com/,
AI ROBOTICS FRANCE,startup,,"From innovation to excellence.

Since its founding, Al Robotics has undergone remarkable growth as a pioneer in the field of robotics and artificial intelligence. ",https://airobotics.fr/,
